{
  "$schema": "../../schemas/theme-artwork-defaults-v1.schema.json",
  "schemaVersion": 1,
  "themeId": "suisui.inkscape-dawn",
  "defaultsVersion": "1.1.2",
  "slots": {
    "hero": {
      "light": {
        "asset": "hero-light",
        "placement": {
          "size": {
            "width": "cover",
            "height": "auto"
          },
          "position": {
            "x": "center",
            "y": "36.01345514%"
          },
          "scale": 1,
          "origin": {
            "x": "center",
            "y": "36.01345514%"
          },
          "mirrorX": false,
          "mirrorY": false
        },
        "effects": {
          "brightness": 100,
          "contrast": 100,
          "saturation": 100,
          "opacity": 100,
          "grayscale": 0,
          "hueRotate": 0,
          "blur": 0,
          "blendMode": "normal",
          "overlay": {
            "color": "#000000",
            "opacity": 0
          },
          "gradientVeil": {
            "enabled": false,
            "strength": 0,
            "layers": []
          },
          "vignette": 0,
          "readabilityVeil": {
            "enabled": false,
            "color": "#000000",
            "opacity": 0,
            "directionDeg": 90,
            "rangeStart": 0,
            "rangeEnd": 100
          }
        },
        "motion": {
          "mode": "none"
        }
      },
      "dark": {
        "asset": "hero-dark",
        "placement": {
          "size": {
            "width": "cover",
            "height": "auto"
          },
          "position": {
            "x": "58%",
            "y": "40%"
          },
          "scale": 1.08,
          "origin": {
            "x": "58%",
            "y": "40%"
          },
          "mirrorX": false,
          "mirrorY": false
        },
        "effects": {
          "brightness": 100,
          "contrast": 100,
          "saturation": 100,
          "opacity": 100,
          "grayscale": 0,
          "hueRotate": 0,
          "blur": 0,
          "blendMode": "normal",
          "overlay": {
            "color": "#000000",
            "opacity": 0
          },
          "gradientVeil": {
            "enabled": false,
            "strength": 0,
            "layers": []
          },
          "vignette": 0,
          "readabilityVeil": {
            "enabled": false,
            "color": "#000000",
            "opacity": 0,
            "directionDeg": 90,
            "rangeStart": 0,
            "rangeEnd": 100
          }
        },
        "motion": {
          "mode": "none"
        }
      }
    },
    "sidebar": {
      "light": {
        "asset": "sidebar-light",
        "placement": {
          "size": {
            "width": "192.677%",
            "height": "auto"
          },
          "position": {
            "x": "100.64%",
            "y": "-166.0672px"
          },
          "scale": 1,
          "origin": {
            "x": "center",
            "y": "center"
          },
          "mirrorX": false,
          "mirrorY": false
        },
        "effects": {
          "brightness": 100,
          "contrast": 100,
          "saturation": 100,
          "opacity": 100,
          "grayscale": 0,
          "hueRotate": 0,
          "blur": 0,
          "blendMode": "normal",
          "overlay": {
            "color": "#000000",
            "opacity": 0
          },
          "gradientVeil": {
            "enabled": false,
            "strength": 0,
            "layers": []
          },
          "vignette": 0,
          "readabilityVeil": {
            "enabled": false,
            "color": "#000000",
            "opacity": 0,
            "directionDeg": 90,
            "rangeStart": 0,
            "rangeEnd": 100
          }
        }
      },
      "dark": {
        "asset": "sidebar-dark",
        "placement": {
          "size": {
            "width": "202.659%",
            "height": "auto"
          },
          "position": {
            "x": "91.12%",
            "y": "-226.30911796px"
          },
          "scale": 1,
          "origin": {
            "x": "center",
            "y": "center"
          },
          "mirrorX": false,
          "mirrorY": false
        },
        "effects": {
          "brightness": 100,
          "contrast": 100,
          "saturation": 100,
          "opacity": 100,
          "grayscale": 0,
          "hueRotate": 0,
          "blur": 0,
          "blendMode": "normal",
          "overlay": {
            "color": "#000000",
            "opacity": 0
          },
          "gradientVeil": {
            "enabled": false,
            "strength": 0,
            "layers": []
          },
          "vignette": 0,
          "readabilityVeil": {
            "enabled": false,
            "color": "#000000",
            "opacity": 0,
            "directionDeg": 90,
            "rangeStart": 0,
            "rangeEnd": 100
          }
        }
      }
    },
    "chat": {
      "light": {
        "asset": "chat-light",
        "placement": {
          "size": {
            "width": "cover",
            "height": "auto"
          },
          "position": {
            "x": "48.13714534064783%",
            "y": "0%"
          },
          "scale": 1.08,
          "origin": {
            "x": "48.13714534064783%",
            "y": "0%"
          },
          "mirrorX": false,
          "mirrorY": false
        },
        "effects": {
          "brightness": 100,
          "contrast": 100,
          "saturation": 100,
          "opacity": 100,
          "grayscale": 0,
          "hueRotate": 0,
          "blur": 0,
          "blendMode": "normal",
          "overlay": {
            "color": "#000000",
            "opacity": 0
          },
          "gradientVeil": {
            "enabled": true,
            "strength": 13.197969543147211,
            "layers": [
              {
                "directionDeg": 90,
                "start": 0,
                "end": 100,
                "stops": [
                  {
                    "position": 0,
                    "color": "#FFFEF8",
                    "opacity": 82
                  },
                  {
                    "position": 46,
                    "color": "#FFFEF8",
                    "opacity": 57
                  },
                  {
                    "position": 76,
                    "color": "#FFFEF8",
                    "opacity": 24
                  },
                  {
                    "position": 100,
                    "color": "#FFFEF8",
                    "opacity": 10
                  }
                ]
              }
            ]
          },
          "vignette": 0,
          "readabilityVeil": {
            "enabled": false,
            "color": "#000000",
            "opacity": 0,
            "directionDeg": 90,
            "rangeStart": 0,
            "rangeEnd": 100
          }
        }
      },
      "dark": {
        "asset": "chat-dark",
        "placement": {
          "size": {
            "width": "cover",
            "height": "auto"
          },
          "position": {
            "x": "center",
            "y": "center"
          },
          "scale": 1,
          "origin": {
            "x": "50%",
            "y": "50%"
          },
          "mirrorX": false,
          "mirrorY": false
        },
        "effects": {
          "brightness": 100,
          "contrast": 100,
          "saturation": 100,
          "opacity": 100,
          "grayscale": 0,
          "hueRotate": 0,
          "blur": 0,
          "blendMode": "normal",
          "overlay": {
            "color": "#000000",
            "opacity": 0
          },
          "gradientVeil": {
            "enabled": false,
            "strength": 0,
            "layers": [
              {
                "directionDeg": 90,
                "start": 0,
                "end": 100,
                "stops": [
                  {
                    "position": 0,
                    "color": "#071219",
                    "opacity": 55
                  },
                  {
                    "position": 31,
                    "color": "#071219",
                    "opacity": 24
                  },
                  {
                    "position": 47,
                    "color": "#071219",
                    "opacity": 4
                  },
                  {
                    "position": 58,
                    "color": "#071219",
                    "opacity": 3
                  },
                  {
                    "position": 78,
                    "color": "#071219",
                    "opacity": 24
                  },
                  {
                    "position": 100,
                    "color": "#071219",
                    "opacity": 46
                  }
                ]
              }
            ]
          },
          "vignette": 0,
          "readabilityVeil": {
            "enabled": false,
            "color": "#000000",
            "opacity": 0,
            "directionDeg": 90,
            "rangeStart": 0,
            "rangeEnd": 100
          }
        }
      }
    }
  }
}
